{
  "$schema": "../../schemas/quant/qme-v0.1-contract-v2.schema.json",
  "schema_version": "qme.quantitative_contract.v2",
  "contract_id": "qme-long-only-momentum-v0.1",
  "contract_version": 2,
  "contract_status": "REGISTERED_DECISIONS_PRODUCTION_EVIDENCE_BLOCKED",
  "semantic_sha256": "8375890d:bcc1b0c6:ae75058f:a5cfd966:43d8eb3b:06c686b7:90a5de6d:a5789263",
  "metadata": {
    "document_type": "QUANTITATIVE_CONTRACT",
    "ticket": "NEE-119",
    "strategy_version": "v0.1",
    "stable_strategy_identity": true,
    "scope": "BROAD_AV_SURVIVORSHIP_REDUCED_COMMON_STOCK_PROXY"
  },
  "authority": {
    "ticket": "NEE-119",
    "empirical_results_used": false,
    "source_label": "OWNER_MANDATE_2026-08-12",
    "owner_approval": {
      "approval_owner": "neeljaiswal90",
      "approved_at": "2026-08-12T16:57:29Z"
    },
    "proposal": {
      "path": "docs/governance/M0_REGISTRATION_PROPOSALS_2026-08-12.md",
      "sha256": "5869d313:e179e442:e305704e:7cff5031:786d7452:73c0f864:bc910784:8685847c",
      "commit": "6a0042a3:3b4bcf1d:5f5bc3ab:0bf45777:ab50deaa"
    },
    "m0_registration": {
      "registration_id": "M0-OWNER-MANDATE-REGISTRATION-2026-08-12-V1",
      "path": "configs/governance/m0-registration-v1.json",
      "sha256": "fc61bb24:5e99c5a7:ac8de1ad:f909b785:2f3a651c:7925d0fb:63037db7:45946756",
      "manifest_path": "configs/governance/m0-registration-v1.hashes.json",
      "manifest_sha256": "b1375860:485bf393:df34d588:545bf1a2:738f5efd:c703825c:62c3430c:b427c6db",
      "protected_main_commit": "fd0a3847:7ba73e6f:4b9e3d6b:26af8de3:46a1ddcc",
      "effective_at": "2026-08-12T17:40:28Z"
    },
    "materialization_crosswalk": {
      "crosswalk_id": "NEE-172-S0A-1-CONTRACT-MATERIALIZATION-CROSSWALK-V2",
      "path": "configs/governance/s0a-contract-materialization-crosswalk-v2.json",
      "sha256": "11f1de4d:51816cad:7d958fe9:2946e18f:e968d9de:7537006e:00f80577:c11942d1"
    },
    "unavailable_inputs": [
      "production_point_in_time_membership_and_identity_snapshot_pair",
      "production_total_return_raw_receipts_and_corporate_action_fixture_evidence"
    ],
    "notes": "Registered authority and breadth decisions are materialized. No unavailable production evidence is inferred."
  },
  "lineage": {
    "predecessor_schema_version": "qme.quantitative_contract.v1",
    "predecessor_contract_id": "qme-long-only-momentum-v0.1",
    "predecessor_path": "configs/quant/qme-v0.1-contract.json",
    "predecessor_sha256": "47070e58:27292e74:567ae32a:eff58bcc:2c58e472:0edaa2d5:57435eb2:a5f472fa",
    "version_change_policy": "NEW_VERSION_NO_OVERWRITE"
  },
  "claims": {
    "production_ready": false,
    "data_spine_start_authorized": false,
    "empirical_performance_available": false,
    "alpha_proven": false,
    "authoritative_nasdaq_100_membership_available": false,
    "production_point_in_time_evidence_available": false
  },
  "numeric_policy": {
    "input_encoding": "canonical_decimal_string",
    "binary_float_forbidden": true,
    "decimal_precision_digits": 50,
    "rounding_mode": "ROUND_HALF_EVEN",
    "signal_artifact_scale": 18,
    "weight_artifact_scale": 18,
    "basis_points_denominator": 10000
  },
  "contract_bindings": {
    "accounting_equation_spec_id": "NEE-118-QME-ACCOUNTING-V1",
    "accounting_equation_spec_path": "docs/quant/QME_ACCOUNTING_EXECUTION_METRICS_SPEC.md",
    "accounting_equation_spec_sha256": "27e906a6:12eb61a2:f12947ff:3696cb90:7d56d883:e45c99a7:503011fe:13bb8840",
    "accounting_coordinate": "RAW_CASH_RAW_SHARES_RAW_EXECUTION_PRICES_RAW_MARKS",
    "total_return_methodology_id": "qme-point-in-time-total-return-close-v1",
    "total_return_methodology_path": "configs/quant/qme-v0.1-total-return-methodology.json",
    "total_return_methodology_sha256": "95381821:c1c8ff00:e0e626b3:d7ee3646:6d12c3be:9e6b8cb7:5ee166f0:043454ac",
    "source_freshness_policy": {
      "policy_id": "qme-source-freshness-policy-v1",
      "path": "configs/quant/source-freshness-policy-v1.json",
      "sha256": "3dd94e35:0cc89023:e10efd2a:934e9a67:a502a1c8:4b5478db:82a98958:2ab71edc"
    }
  },
  "point_in_time_identity": {
    "stable_key": "security_id",
    "stable_key_normalization": "UNICODE_NFC",
    "stable_key_order": "UTF8_BYTES_ASCENDING",
    "security_id_unique_within_snapshot": true,
    "security_id_unique_after_normalization": true,
    "membership_coordinate": "signal_session_close",
    "required_run_bindings": [
      "analysis_as_of",
      "signal_session",
      "exchange_calendar_id",
      "exchange_calendar_hash",
      "ordered_session_vector_hash",
      "membership_snapshot_id",
      "membership_snapshot_hash",
      "identity_snapshot_id",
      "identity_snapshot_hash",
      "price_snapshot_id",
      "price_snapshot_hash",
      "total_return_methodology_id",
      "total_return_methodology_hash",
      "source_freshness_policy_hash",
      "accounting_equation_spec_id",
      "accounting_equation_spec_hash",
      "common_raw_execution_mark_snapshot_hash",
      "cost_policy_hash",
      "tax_policy_hash",
      "fee_policy_hash",
      "contract_config_hash",
      "contract_spec_hash"
    ],
    "universe_claim": "AV_SURVIVORSHIP_REDUCED_COMMON_STOCK_PROXY",
    "future_membership_or_identity_data_forbidden": true,
    "membership_and_identity_authority": {
      "membership_source": "ALPHA_VANTAGE_LISTING_STATUS_EXACT_SIGNAL_DATE",
      "identity_cross_check": "SEC_CIK_FILING_AVAILABLE_BY_CUTOFF",
      "source_order": [
        "ALPHA_VANTAGE_LISTING_STATUS_ACTIVE_AND_DELISTED_EXACT_SIGNAL_DATE_MONTHLY_IMMUTABLE_RAW_CSV_SHA256",
        "SEC_COMPANY_TICKERS_AND_SUBMISSIONS_CIK_CROSS_CHECK_NOT_MEMBERSHIP_AUTHORITY_FILING_AVAILABLE_BY_CUTOFF_OR_EXCLUDE",
        "MANUAL_REVIEW_AMBIGUOUS_RENAMES_OR_REUSE_EXCLUDED_IN_V0_1"
      ],
      "blocker_clear_condition": "FIRST_IMMUTABLE_MEMBERSHIP_AND_IDENTITY_SNAPSHOT_PAIR_HASH_BOUND_IN_RUN",
      "production_snapshot_pair": null,
      "production_snapshot_pair_status": "UNAVAILABLE_PRODUCTION_EVIDENCE_BLOCKING"
    }
  },
  "eligibility": {
    "required_membership_status": "IN_UNIVERSE_AT_SIGNAL_SESSION",
    "required_identity_status": "VERIFIED_AT_SIGNAL_CUTOFF",
    "required_asset_class": "COMMON_STOCK_PROXY",
    "excluded_asset_classes": [
      "ADR",
      "AMBIGUOUS_IDENTITY",
      "ETF",
      "PREFERRED",
      "REIT",
      "RIGHT",
      "SPAC_ARTIFACT",
      "UNIT",
      "WARRANT",
      "WHEN_ISSUED"
    ],
    "price_floor": {"enabled": false, "value": null, "status": "NOT_REGISTERED_NOT_ACTIVE"},
    "liquidity_floor": {"enabled": false, "value": null, "status": "NOT_REGISTERED_NOT_ACTIVE"}
  },
  "signal": {
    "name": "12_1_TOTAL_RETURN_LOG_MOMENTUM",
    "signal_session_rule": "LAST_EXCHANGE_SESSION_OF_CALENDAR_MONTH",
    "session_vector_order": "STRICT_ASCENDING_UNIQUE_EXCHANGE_SESSIONS",
    "signal_session_position": "LAST_ELEMENT",
    "recent_anchor_derivation": "ordered_sessions[index(signal_session)-21]",
    "old_anchor_derivation": "ordered_sessions[index(signal_session)-252]",
    "price_coordinate": "POINT_IN_TIME_TOTAL_RETURN_CLOSE_AS_KNOWN_AT_SIGNAL_CUTOFF",
    "recent_anchor_exchange_session_offset": -21,
    "old_anchor_exchange_session_offset": -252,
    "minimum_observed_sessions_including_t": 253,
    "formula": "ln(TR[t-21] / TR[t-252])",
    "calculation_order": "decimal_ratio_then_natural_log",
    "ranking_value": "UNROUNDED_50_DIGIT_DECIMAL_CONTEXT_RESULT",
    "diagnostic_simple_return": {
      "allowed": true,
      "formula": "TR[t-21] / TR[t-252] - 1",
      "label": "DIAGNOSTIC_SIMPLE_RETURN_NOT_AUTHORITY",
      "may_replace_log_statistics": false
    },
    "nearest_session_substitution_allowed": false,
    "nonpositive_anchor_allowed": false,
    "authoritative_freshness_policy_required": true,
    "production_total_return_source_registration": {
      "source_rule": {
        "source_set": [
          "ALPHA_VANTAGE_TIME_SERIES_DAILY_RAW_OHLCV",
          "ALPHA_VANTAGE_DIVIDENDS",
          "ALPHA_VANTAGE_SPLITS"
        ],
        "raw_response_cache": "IMMUTABLE",
        "total_return_construction": "SELF_COMPUTED_UNDER_QME_POINT_IN_TIME_TOTAL_RETURN_CLOSE_V1",
        "acceptance_evidence": "PRODUCTION_CORPORATE_ACTION_FIXTURE_SET_REPRODUCED_FROM_SNAPSHOTS",
        "production_receipts_available": false
      },
      "production_receipts_and_fixture_evidence": null,
      "status": "UNAVAILABLE_PRODUCTION_EVIDENCE_BLOCKING"
    }
  },
  "ranking": {
    "eligible_status": "SCORABLE",
    "direction": "DESCENDING",
    "best_rank": 1,
    "rank_method": "UNIQUE_ORDINAL_AFTER_STABLE_TIE_BREAK",
    "total_order": ["signal_decimal_descending", "security_id_utf8_bytes_ascending"],
    "input_row_order_authoritative": false,
    "duplicate_security_id_state": "INVALID_DUPLICATE_SECURITY_ID"
  },
  "selection": {
    "formula": "min(50, floor(20 * N_t / 100))",
    "integer_implementation": "min(50, (20 * N_t) // 100)",
    "maximum_names": 50,
    "fraction_numerator": 20,
    "fraction_denominator": 100,
    "minimum_selected_holdings": 30,
    "minimum_rank_eligible_breadth": {
      "value": 150,
      "unit": "security_count",
      "status": "REGISTERED_OWNER_MANDATE",
      "source_type": "OWNER_MANDATE",
      "acceptable_source_types": [
        "OWNER_MANDATE",
        "PRE_REGISTERED_UNIVERSE_EVIDENCE"
      ],
      "boundary_proof": "floor(0.2 * 150) = 30",
      "sensitivity_range": [125, 150, 200],
      "sensitivity_role": "REPORTING_ONLY",
      "nasdaq_100_profile_inherits_breadth": false
    },
    "breadth_equal_to_registered_minimum": "VALID",
    "breadth_below_registered_minimum": "INVALID_INSUFFICIENT_BREADTH",
    "zero_selection_size": "INVALID_ZERO_SELECTION_SIZE",
    "boundary_tie_policy": "SPLIT_BY_STABLE_SECURITY_ID_ORDER"
  },
  "weighting": {
    "control_target": "EQUAL_WEIGHT",
    "ideal_weight_authority": "EXACT_RATIONAL",
    "target_weight_rational": {"numerator": 1, "denominator": "K_t"},